{
  "type": "DDATA",
  "protocol_version": 1,
  "session_id": "s-1",
  "seq": 2,
  "lane": "data",
  "device": "P1",
  "boot_id": "board-01-boot-1",
  "historical": false,
  "metrics": [
    {
      "alias": 1,
      "value": 42.0,
      "quality": "good",
      "event_time_ns": 1767225660000000000,
      "time_source": "device",
      "uncertainty_ms": 5
    }
  ]
}
